{
  "job_id": "unity-roadmap-intern-3-months",
  "run_id": "2026-06-08-v2",
  "status": "complete",
  "created_at": "2026-06-08T12:30:00+07:00",
  "updated_at": "2026-06-08T12:46:00+07:00",
  "approval": {
    "status": "approved",
    "approved_at": "2026-06-08T12:05:00+07:00",
    "approved_by": "user",
    "overrides": [
      "Use dark-neon game UI visual direction instead of the default light SUN.STUDIO look while retaining SUN.STUDIO resources and local fonts."
    ]
  },
  "inputs": [
    {
      "path": "input/Prompt.md",
      "role": "mixed",
      "checksum": "48fb72080a24c04eee3b0a48a935e1d61df52d3d7c4f7a75cdd50d600e10fb50"
    }
  ],
  "selected_visual_items": [
    {
      "slide": 2,
      "item_id": "sun.component.phase-timeline",
      "action": "reuse",
      "score": 100.0
    },
    {
      "slide": 3,
      "item_id": "sun.component.value-grid",
      "action": "reuse",
      "score": 85.0
    },
    {
      "slide": 4,
      "item_id": "sun.component.swimlane",
      "action": "reuse",
      "score": 89.17
    },
    {
      "slide": 5,
      "item_id": "sun.component.chevron-flow",
      "action": "reuse",
      "score": 93.0
    },
    {
      "slide": 6,
      "item_id": "sun.component.value-grid",
      "action": "adapt-local",
      "score": 70.83
    }
  ],
  "capability_report": "analysis/capability-report.json",
  "limitations": [
    "No real Unity 3D model asset was provided; cover uses local Unity/gamepad iconography and CSS isometric geometry.",
    "This run targets HTML only. PPTX/PDF can be generated in a later run with documented renderer limitations.",
    "v2 is a visual polish variant of v1 and preserves the same approved source content."
  ],
  "outputs": [
    {
      "type": "html",
      "path": "html/index.html",
      "status": "complete"
    },
    {
      "type": "qa-report",
      "path": "qa/qa-report.md",
      "status": "complete"
    },
    {
      "type": "delivery-report",
      "path": "reports/delivery-report.md",
      "status": "complete"
    },
    {
      "type": "polish-notes",
      "path": "analysis/polish-notes.md",
      "status": "complete"
    }
  ],
  "checksums": {
    "html/index.html": "e739fbb84cfc165b4303d96882e8b698f4bd2449d44203869d2a80339d7ce5ba",
    "html/deck-stage.js": "eac2199dccb470b7ee752c62808131ede4f54ce3990d79a87336e67f53e7f30f",
    "approval-package.md": "082f6554b47878e2c286180b81e7dbe5ecaa038a9f832f3e14028b852aff3262",
    "analysis/polish-notes.md": "91b3801d8df2e6fe177692ce98f61f3d725e3b4be57c0d548862d39400641ecc",
    "qa/qa-report.md": "94f5d5261d973bb84db5c6c9fdab4a71ff43876b4c709e47c50e8acb87cbb561",
    "reports/delivery-report.md": "f2488c120289be913808b1ea65459b7860bebe792f83457aea2ced1a9f51e4f8"
  }
}